{
  "schema": "sign-safe/verdict@1",
  "decision": "HOLD",
  "requiresHumanReview": true,
  "reason": "Manual review required: HOLD-class primitive(s): Token-2022 PermanentDelegate (configure/use).",
  "messageVersion": "legacy",
  "worstSeverity": "HOLD",
  "findings": [
    {
      "id": "token2022-permanent-delegate",
      "label": "Token-2022 PermanentDelegate (configure/use)",
      "severity": "HOLD",
      "category": "token-2022-extension",
      "instructionIndex": 0,
      "programId": "TokenzQdBNbLqP5VEhdkAS6EPFLC1PHnBqCXEpPxuEb",
      "detail": "Matched PermanentDelegate on token-2022.",
      "mapsToLoss": "A permanent delegate can move or burn tokens from any holder irrevocably; configuring or exercising it is a seizure vector."
    }
  ],
  "outflow": {
    "lamports": "0",
    "splTransfers": [],
    "exceedsLamportThreshold": false,
    "lamportTransfers": [],
    "outboundToNonSigner": false
  },
  "flags": {
    "unknownProgramPresent": false,
    "altLookupsPresent": false,
    "rolesUnverified": false,
    "decodeFailed": false
  },
  "unknownPrograms": []
}
